<!ELEMENT etudiants (etudiant*)>
<!ELEMENT etudiant (nom, prenom, adr_mail, tel*, age?)>
<!ELEMENT nom (#PCDATA)>
<!ELEMENT prenom (#PCDATA)>
<!ELEMENT adr_mail (#PCDATA)>
<!ELEMENT tel (#PCDATA)>
<!ELEMENT age (#PCDATA)>
<!ATTLIST etudiant
  login ID #REQUIRED
  password CDATA #IMPLIED>
